{
  "active_defect_ids": [
    "P1.9",
    "P1.10",
    "P1.11",
    "P1.12",
    "P1.13",
    "P1.14",
    "P1.15", "P1.16"
  ],
  "audit_date": "2026-10-02",
  "claims": [
    {
      "category": "kernel",
      "check_paths": [
        "scripts/check_upgrade_plan_health.sh",
        "scripts/check_no_user_panics.sh"
      ],
      "evidence_ids": [
        "E1:cap-kernel-determinism/check-1",
        "E1:cap-kernel-determinism/check-2"
      ],
      "gap_ids": [
        "R7.2.a",
        "P1.13"
      ],
      "host_binding_paths": [],
      "id": "CAP-KERNEL-DETERMINISM",
      "immutable_evidence_ids": [],
      "implementation_paths": [
        "crates/gc_kernel/src"
      ],
      "limitations": "Implementation or routing exists, but the mapped checks are not yet pinned as per-platform L2 evidence and no cross-host L3, product L4, or immutable release L5 evidence is recorded. The 2026-10-01 review additionally blocks qualification on P1.13; ROADMAP.md section 3.29 defines fresh reproduction, correction and acceptance requirements.",
      "maturity": "L1",
      "maturity_by_platform": {
        "linux-arm64": "L0",
        "linux-x86_64": "L1",
        "macos-arm64": "L1",
        "windows-x86_64": "L0"
      },
      "owner": "kernel-runtime",
      "selfhost_level": "N/A",
      "spec_paths": [
        "docs/spec/CLI.md",
        "docs/spec/SEALS_DISPATCH_REPLAY.md",
        "docs/spec/DETERMINISM.md"
      ],
      "title": "Pure deterministic kernel separated from effects"
    },
    {
      "category": "semantic-ir",
      "check_paths": [
        "scripts/check_upgrade_plan_health.sh"
      ],
      "evidence_ids": [
        "E1:cap-coreform-identity/check-1"
      ],
      "gap_ids": [
        "R7.2.f",
        "P1.9"
      ],
      "host_binding_paths": [],
      "id": "CAP-COREFORM-IDENTITY",
      "immutable_evidence_ids": [],
      "implementation_paths": [
        "crates/gc_coreform/src"
      ],
      "limitations": "Implementation or routing exists, but the mapped checks are not yet pinned as per-platform L2 evidence and no cross-host L3, product L4, or immutable release L5 evidence is recorded. The 2026-10-01 review additionally blocks qualification on P1.9; ROADMAP.md section 3.29 defines fresh reproduction, correction and acceptance requirements.",
      "maturity": "L1",
      "maturity_by_platform": {
        "linux-arm64": "L0",
        "linux-x86_64": "L1",
        "macos-arm64": "L1",
        "windows-x86_64": "L0"
      },
      "owner": "coreform",
      "selfhost_level": "H0",
      "spec_paths": [
        "docs/spec/CLI.md",
        "docs/spec/COREFORM_CANON_HASH.md"
      ],
      "title": "Canonical CoreForm IR + stable content hash identity"
    },
    {
      "category": "kernel",
      "check_paths": [
        "scripts/check_upgrade_plan_health.sh",
        "scripts/check_no_user_panics.sh"
      ],
      "evidence_ids": [
        "E1:cap-sealed-protocol/check-1",
        "E1:cap-sealed-protocol/check-2"
      ],
      "gap_ids": [
        "R7.2.b"
      ],
      "host_binding_paths": [],
      "id": "CAP-SEALED-PROTOCOL",
      "immutable_evidence_ids": [],
      "implementation_paths": [
        "crates/gc_kernel/src",
        "crates/gc_prelude/src"
      ],
      "limitations": "Implementation or routing exists, but the mapped checks are not yet pinned as per-platform L2 evidence and no cross-host L3, product L4, or immutable release L5 evidence is recorded.",
      "maturity": "L1",
      "maturity_by_platform": {
        "linux-arm64": "L0",
        "linux-x86_64": "L1",
        "macos-arm64": "L1",
        "windows-x86_64": "L0"
      },
      "owner": "kernel-runtime",
      "selfhost_level": "N/A",
      "spec_paths": [
        "docs/spec/CLI.md",
        "docs/spec/SEALS_DISPATCH_REPLAY.md",
        "docs/spec/DETERMINISM.md"
      ],
      "title": "Sealed unforgeable `UNHANDLED`/`EFFECT`/`ERROR` protocol"
    },
    {
      "category": "effects",
      "check_paths": [
        "scripts/check_upgrade_plan_health.sh"
      ],
      "evidence_ids": [
        "E1:cap-deny-default-policy/check-1"
      ],
      "gap_ids": [
        "R7.3.a",
        "P1.10"
      ],
      "host_binding_paths": [
        "crates/gc_effects/src"
      ],
      "id": "CAP-DENY-DEFAULT-POLICY",
      "immutable_evidence_ids": [],
      "implementation_paths": [
        "crates/gc_effects/src"
      ],
      "limitations": "Implementation or routing exists, but the mapped checks are not yet pinned as per-platform L2 evidence and no cross-host L3, product L4, or immutable release L5 evidence is recorded. The 2026-10-01 review additionally blocks qualification on P1.10; ROADMAP.md section 3.29 defines fresh reproduction, correction and acceptance requirements.",
      "maturity": "L1",
      "maturity_by_platform": {
        "linux-arm64": "L0",
        "linux-x86_64": "L1",
        "macos-arm64": "L1",
        "windows-x86_64": "L0"
      },
      "owner": "effect-runtime",
      "selfhost_level": "H2",
      "spec_paths": [
        "docs/spec/CLI.md"
      ],
      "title": "Deny-by-default capability policy runtime"
    },
    {
      "category": "effects",
      "check_paths": [
        "scripts/check_upgrade_plan_health.sh",
        "scripts/check_no_user_panics.sh"
      ],
      "evidence_ids": [
        "E1:cap-effect-replay/check-1",
        "E1:cap-effect-replay/check-2"
      ],
      "gap_ids": [
        "R7.2.c",
        "P1.9",
        "P1.10",
        "P1.11",
        "P1.12"
      ],
      "host_binding_paths": [
        "crates/gc_effects/src"
      ],
      "id": "CAP-EFFECT-REPLAY",
      "immutable_evidence_ids": [],
      "implementation_paths": [
        "crates/gc_effects/src"
      ],
      "limitations": "Implementation or routing exists, but the mapped checks are not yet pinned as per-platform L2 evidence and no cross-host L3, product L4, or immutable release L5 evidence is recorded. The 2026-10-01 review additionally blocks qualification on P1.9, P1.10, P1.11, P1.12; ROADMAP.md section 3.29 defines fresh reproduction, correction and acceptance requirements.",
      "maturity": "L1",
      "maturity_by_platform": {
        "linux-arm64": "L0",
        "linux-x86_64": "L1",
        "macos-arm64": "L1",
        "windows-x86_64": "L0"
      },
      "owner": "effect-runtime",
      "selfhost_level": "H2",
      "spec_paths": [
        "docs/spec/CLI.md",
        "docs/spec/SEALS_DISPATCH_REPLAY.md",
        "docs/spec/DETERMINISM.md"
      ],
      "title": "Deterministic effect logs + replay checker"
    },
    {
      "category": "toolchain",
      "check_paths": [
        "scripts/check_upgrade_plan_health.sh"
      ],
      "evidence_ids": [
        "E1:cap-semantic-vcs/check-1"
      ],
      "gap_ids": [
        "R4.2.e",
        "P1.9",
        "P1.10",
        "P1.11",
        "P1.12",
        "P1.14"
      ],
      "host_binding_paths": [],
      "id": "CAP-SEMANTIC-VCS",
      "immutable_evidence_ids": [],
      "implementation_paths": [
        "crates/gc_vcs/src",
        "crates/gc_patches/src"
      ],
      "limitations": "Implementation or routing exists, but the mapped checks are not yet pinned as per-platform L2 evidence and no cross-host L3, product L4, or immutable release L5 evidence is recorded. The 2026-10-01 review additionally blocks qualification on P1.9, P1.10, P1.11, P1.12, P1.14; ROADMAP.md section 3.29 defines fresh reproduction, correction and acceptance requirements.",
      "maturity": "L1",
      "maturity_by_platform": {
        "linux-arm64": "L0",
        "linux-x86_64": "L1",
        "macos-arm64": "L1",
        "windows-x86_64": "L0"
      },
      "owner": "vcs-patches",
      "selfhost_level": "H0",
      "spec_paths": [
        "docs/spec/CLI.md"
      ],
      "title": "Built-in semantic VCS (`commit`/`patch`/`refs`/`merge3`)"
    },
    {
      "category": "toolchain",
      "check_paths": [
        "scripts/check_upgrade_plan_health.sh",
        "scripts/check_foundation_stdlib_conformance.sh"
      ],
      "evidence_ids": [
        "E1:cap-package-manager/check-1",
        "E1:cap-package-manager/check-2"
      ],
      "gap_ids": [
        "R4.2.e",
        "R6.1.a",
        "P1.9",
        "P1.10",
        "P1.11",
        "P1.12",
        "P1.13",
        "P1.14",
        "P1.15"
      ],
      "host_binding_paths": [],
      "id": "CAP-PACKAGE-MANAGER",
      "immutable_evidence_ids": [],
      "implementation_paths": [
        "crates/gc_pkg/src",
        "crates/gc_cli_driver/src"
      ],
      "limitations": "Implementation or routing exists, but the mapped checks are not yet pinned as per-platform L2 evidence and no cross-host L3, product L4, or immutable release L5 evidence is recorded. The 2026-10-01 review additionally blocks qualification on P1.9, P1.10, P1.11, P1.12, P1.13, P1.14, P1.15; ROADMAP.md section 3.29 defines fresh reproduction, correction and acceptance requirements.",
      "maturity": "L1",
      "maturity_by_platform": {
        "linux-arm64": "L0",
        "linux-x86_64": "L1",
        "macos-arm64": "L1",
        "windows-x86_64": "L0"
      },
      "owner": "package-registry",
      "selfhost_level": "H0",
      "spec_paths": [
        "docs/spec/CLI.md",
        "docs/spec/GCPM_BUNDLE_v0.1.md",
        "docs/spec/GCPM_JSON_SCHEMAS_v0.1.md"
      ],
      "title": "Built-in package/project manager (`pkg`/`gcpm`)"
    },
    {
      "category": "toolchain",
      "check_paths": [
        "scripts/check_upgrade_plan_health.sh",
        "scripts/check_foundation_stdlib_conformance.sh",
        "scripts/check_selfhost_boundary.sh",
        "scripts/check_selfhost_artifact_fresh.sh"
      ],
      "evidence_ids": [
        "E1:cap-artifact-gc/check-1",
        "E1:cap-artifact-gc/check-2",
        "E1:cap-artifact-gc/check-3",
        "E1:cap-artifact-gc/check-4"
      ],
      "gap_ids": [
        "R4.2.e"
      ],
      "host_binding_paths": [],
      "id": "CAP-ARTIFACT-GC",